{
  "$schema": "http://json-schema.org/draft-07/schema#",
  "$id": "tournament.schema.json",
  "title": "World Cup 2026 Tournament",
  "type": "object",
  "additionalProperties": false,
  "required": ["name", "hosts", "groups"],
  "properties": {
    "name": { "type": "string" },
    "edition": { "type": "integer" },
    "hosts": { "type": "array", "items": { "type": "string" } },
    "start_date": { "type": "string", "pattern": "^\\d{4}-\\d{2}-\\d{2}$" },
    "end_date": { "type": "string", "pattern": "^\\d{4}-\\d{2}-\\d{2}$" },
    "format": { "type": "string" },
    "currency": { "type": "string" },
    "data_disclaimer": { "type": "string" },
    "draw": {
      "type": "object",
      "additionalProperties": false,
      "properties": {
        "date": { "type": "string" },
        "location": { "type": "string" }
      }
    },
    "groups": {
      "type": "object",
      "patternProperties": {
        "^[A-L]$": {
          "type": "array",
          "minItems": 4,
          "maxItems": 4,
          "items": { "type": "string", "pattern": "^[a-z0-9-]+$" }
        }
      },
      "additionalProperties": false
    }
  }
}
